{
  "absolute_cost_ceiling_usd": "5.00",
  "checked_at": "2026-08-27T08:42:02Z",
  "conservative_hourly_usd": "1.000416348",
  "evidence_sha256": "bca57a15b3789c58754b188b6bdd751b862f9a8404204e02117673a1dac3942f",
  "machine_type": "g2-standard-12",
  "region": "us-east1",
  "schema_version": "ganesh-mini-gate3-price-evidence/v2",
  "source": "https://cloud.google.com/products/compute/pricing/accelerator-optimized",
  "status": "verified",
  "support_reserve_usd": "0.35"
}
